{
  "type": "object",
  "properties": {
    "id": {
      "type": "string",
      "minLength": 1
    },
    "version": {
      "type": "string",
      "const": "v1"
    },
    "name": {
      "type": "string"
    },
    "description": {
      "type": "string"
    },
    "nodes": {
      "type": "array",
      "items": {
        "type": "object",
        "properties": {
          "id": {
            "type": "string",
            "minLength": 1
          },
          "type": {
            "type": "string",
            "minLength": 1
          },
          "data": {
            "type": "object",
            "additionalProperties": {},
            "default": {}
          },
          "position": {
            "type": "object",
            "properties": {
              "x": {
                "type": "number"
              },
              "y": {
                "type": "number"
              }
            },
            "required": [
              "x",
              "y"
            ],
            "additionalProperties": false
          },
          "width": {
            "type": "number",
            "exclusiveMinimum": 0
          },
          "height": {
            "type": "number",
            "exclusiveMinimum": 0
          }
        },
        "required": [
          "id",
          "type"
        ],
        "additionalProperties": false
      },
      "minItems": 1
    },
    "edges": {
      "type": "array",
      "items": {
        "type": "object",
        "properties": {
          "id": {
            "type": "string",
            "minLength": 1
          },
          "source": {
            "type": "string",
            "minLength": 1
          },
          "target": {
            "type": "string",
            "minLength": 1
          },
          "sourceHandle": {
            "type": [
              "string",
              "null"
            ]
          }
        },
        "required": [
          "id",
          "source",
          "target"
        ],
        "additionalProperties": false
      },
      "default": []
    }
  },
  "required": [
    "id",
    "version",
    "nodes"
  ],
  "additionalProperties": false,
  "$schema": "http://json-schema.org/draft-07/schema#"
}
