{
	"id": "login-and-profile",
	"version": "v1",
	"name": "Login and profile (dummyjson)",
	"description": "POST login then GET /auth/me using the returned access token (dummyjson)",
	"nodes": [
		{
			"id": "start",
			"type": "start",
			"data": {
				"label": "Start"
			},
			"position": {
				"x": -264,
				"y": 8
			},
			"width": 210,
			"height": 87
		},
		{
			"id": "input",
			"type": "input",
			"data": {
				"label": "Credentials",
				"value": {
					"username": "emilys",
					"password": "emilyspass"
				}
			},
			"position": {
				"x": -7,
				"y": 12
			},
			"width": 150,
			"height": 87
		},
		{
			"id": "login",
			"type": "http",
			"data": {
				"method": "POST",
				"url": "{{env.API_BASE}}/auth/login",
				"headers": {
					"Content-Type": "application/json"
				},
				"body": "{\n  \"username\": \"{{secrets.username}}\",\n  \"password\": \"{{secrets.password}}\"\n}",
				"label": "Login"
			},
			"position": {
				"x": 0,
				"y": 199.04515841965383
			},
			"width": 210,
			"height": 87
		},
		{
			"id": "accessToken",
			"type": "extract",
			"data": {
				"expression": "body.accessToken",
				"label": "Access token"
			},
			"position": {
				"x": 320.1294494551188,
				"y": 227
			},
			"width": 210,
			"height": 53
		},
		{
			"id": "profile",
			"type": "http",
			"data": {
				"method": "GET",
				"url": "{{env.API_BASE}}/auth/me",
				"headers": {
					"Authorization": "Bearer {{nodes.accessToken}}"
				},
				"label": "Profile"
			},
			"position": {
				"x": -4.047294093282517,
				"y": 369
			},
			"width": 210,
			"height": 87
		},
		{
			"id": "assertStatus",
			"type": "assert",
			"data": {
				"checks": [
					{
						"path": "status",
						"equals": 200
					}
				],
				"label": "Assert 200"
			},
			"position": {
				"x": 290.28059298166613,
				"y": 535.5109416723401
			},
			"width": 210,
			"height": 87
		},
		{
			"id": "extractAge",
			"type": "extract",
			"data": {
				"expression": "body.bank.currency",
				"label": "Extract age"
			},
			"position": {
				"x": 311.30874971229,
				"y": 372.4525274389194
			},
			"width": 214,
			"height": 53
		},
		{
			"id": "output",
			"type": "output",
			"data": {
				"label": "Result"
			},
			"position": {
				"x": 312.8593583938059,
				"y": 449.1696533118233
			},
			"width": 150,
			"height": 53
		},
		{
			"id": "http-6d0ea217",
			"type": "http",
			"data": {
				"method": "POST",
				"url": "{{env.API_BASE}}/posts/add",
				"headers": {
					"Content-type": "application/json"
				},
				"body": "{\n  \"title\": \"lol {{nodes.profile.body.address.city}}\",\n  \"userId\": {{nodes.profile.body.id}}\n}",
				"label": "Add post"
			},
			"position": {
				"x": 237.21789670230652,
				"y": 662.2260347223958
			},
			"width": 210,
			"height": 87
		},
		{
			"id": "assert-75da9002",
			"type": "assert",
			"data": {
				"checks": [
					{
						"path": "status",
						"equals": 201
					},
					{
						"path": "body.userId",
						"equals": 1
					}
				],
				"label": "Assert"
			},
			"position": {
				"x": 552.3478404609097,
				"y": 671.6136590884543
			},
			"width": 210,
			"height": 87
		},
		{
			"id": "json-892c1ee8",
			"type": "json",
			"data": {
				"expression": "body",
				"label": "JSON"
			},
			"position": {
				"x": 574.6398642023229,
				"y": 392.9708127193876
			},
			"width": 244,
			"height": 230
		}
	],
	"edges": [
		{
			"id": "e0",
			"source": "start",
			"target": "input",
			"sourceHandle": null
		},
		{
			"id": "e1",
			"source": "input",
			"target": "login",
			"sourceHandle": null
		},
		{
			"id": "e2",
			"source": "login",
			"target": "accessToken",
			"sourceHandle": null
		},
		{
			"id": "e3",
			"source": "accessToken",
			"target": "profile",
			"sourceHandle": null
		},
		{
			"id": "e4",
			"source": "profile",
			"target": "assertStatus",
			"sourceHandle": null
		},
		{
			"id": "e5",
			"source": "profile",
			"target": "extractAge",
			"sourceHandle": null
		},
		{
			"id": "e6",
			"source": "profile",
			"target": "output",
			"sourceHandle": null
		},
		{
			"id": "e-profile-http-6d0ea217-8d68a4",
			"source": "profile",
			"target": "http-6d0ea217",
			"sourceHandle": null
		},
		{
			"id": "e-http-6d0ea217-assert-75da9002-8b3d1a",
			"source": "http-6d0ea217",
			"target": "assert-75da9002",
			"sourceHandle": null
		},
		{
			"id": "e-http-6d0ea217-json-892c1ee8-378b85",
			"source": "http-6d0ea217",
			"target": "json-892c1ee8",
			"sourceHandle": null
		}
	]
}
